0,1.08E+18,2018-12-31 19:49:03+00:00,we see through you and your incessant lies which is why you will get your stupid wall the great wall of china failed to keep out foreign invaders do something youve never done before
1,7.19E+17,2016-04-09 21:33:40+00:00,he never mentions race mexico is not a race beeotch mexicans are not a race they are invaders get it
1,8.50E+17,2017-04-07 15:32:28+00:00,need to bomb north korea too and get all these illegal immigrants out of our country do the job trump you the man 
0,1.16E+18,2019-08-07 13:48:28+00:00,however to cut the story short john was among the six african immigrants whose dead bodies were found lying on the sahara desert by the egyptian immigration officers weeks after he left nigeria they were only identified by their green passports in their pockets
1,1.08E+18,2018-12-30 07:03:17+00:00,this is fucking bullshit smiley girl is right these invaders come and destroy your culture and destroying europe they are trouble makers and bad people trying to take over your country and culture looking for free stuff and raping girls not good 
1,7.47E+17,2016-06-25 02:13:56+00:00,the us should immediately stop taking in english immigrants
1,7.71E+17,2016-09-01 02:19:06+00:00,excited about new term criminal illegal mexican immigrants she says its a mouth full 
0,1.44E+18,2021-09-17 18:32:43+00:00,"lives are at stake you are hurting indian immigrants you need to stop hurting legal immigrants
submit provisions 6000234 to senate parliamentarian in good faith
durbinbansindians
judiciarydems"
1,1.01E+18,2018-06-25 21:29:19+00:00,thefive the chinese built the great wall to keep invaders out so did israel if they were using guns at the border we would send an army to protect the us theyre using the children at the tip of the sphere to invade us
0,1.50E+18,2022-02-27 20:08:26+00:00,happy dominican independence day part of bostons richness is the ability of so many communities to retain their ties to and affection for their ancestry or the lands they were born were a city of immigrants and those who welcome immigrants actionnotjustwords 
1,6.11E+17,2015-06-17 02:27:56+00:00," put her in a and send her back to 1859 georgia
shell play the quickfast"
0,7.91E+17,2016-10-27 03:41:49+00:00,and this aired in san antonio where 90 of our population have family immigrants from mexico
0,8.46E+17,2017-03-26 04:55:06+00:00,and they tell us immigrants to speak the language i wish these they do citizenship test
1,1.01E+18,2018-07-04 22:13:40+00:00,dont waste any more time on joyce its a russian troll or american traitor no real american believes the crap it just wrote in its tweetexcept nazis like and that was their theme yesterday immigrants ruining our culture usa is immigrants
1,8.97E+17,2017-08-15 11:22:15+00:00,ladies and gentlement what can you expect from one racist to another they need to take ass and arpaio and deport them to mexico
0,1.18E+18,2019-09-25 00:22:44+00:00,if honduras rejects the third safe country deal donald trump has threatened the nation with a 1020 percent tax on remittances sent from honduran immigrants in america to their families back home 
0,1.06E+18,2018-11-05 21:42:15+00:00,these are some pretty simple and trusting people here in sw mo changes in culture have happened suddenly here we have quite a few immigrants here from somalia laos mexico hodura india most of my neighbors are 4th and 5th generation locals slow positive cultural adjustment
0,8.32E+17,2017-02-16 19:06:37+00:00,irish italians jews and asians all came here as immigrants whats the problem with mexicans and central americans
0,1.18E+18,2019-09-25 16:00:28+00:00,judge refers to trumps most controversial remarks on immigration including his claims that immigrants from haiti all have aids and that if nigerians are admitted into america they would never go back to their huts 
0,1.57E+18,2022-09-22 17:12:57+00:00,kari lake never called all mexican immigrants rapists and murderers her husband is latino ffs
0,1.06E+18,2018-10-27 17:29:37+00:00,its a great and verybold jewish organization it was formed in the late 19th century to help resettle the jews coming over from eastern europe like my family today hias helps immigrants from everywhere 
0,1.02E+18,2018-07-14 21:05:48+00:00,or lebanese ipa beer or french wine is such a contradiction since he loves immigrants as long as they are not of color given his choice of mistresses acquaintances and eastern european immigrant employees for his us club properties god help us
0,7.24E+17,2016-04-23 20:41:29+00:00,as more latino kids speak only english parents worry about chatting with grandma 
0,9.58E+17,2018-01-29 03:41:03+00:00,this country constitution is nothing because this land god gave to the not immigrants from europe who killed my ancestors
0,5.34E+17,2014-11-16 13:08:13+00:00,breaking news ny mayor signs bills limiting deportation of caribbean immigrants
1,1.47E+18,2021-12-22 14:26:51+00:00,in georgia we building the number one largest illegal immigrants jail in the country over 1100 beds for they ass to and if immigrants blacks trying join and help them know how anti black asf they is be in their to yeap i just said that 
1,1.25E+18,2020-04-21 04:03:34+00:00,oh really they caught 1155 illegal chinese immigrants trying to sneak in our southern border youre truly uninformed and intellectually defunct
0,7.23E+17,2016-04-20 01:55:57+00:00,the impact of retired german immigrants in north dakota ie my nd family
0,1.01E+18,2018-06-23 17:48:38+00:00,trump and his like minded racist regime are murderers of american citizens in puerto rico and will continue to murder american citizens immigrants and more people of color they can be it through etc etc 
0,1.06E+18,2018-11-08 02:04:55+00:00,if youre homeless and not disabled i dont pity you if immigrants can come into this country without knowing a word of english and make something of themselves then there should be no excuse for you
0,1.16E+18,2019-08-15 17:31:41+00:00,"viva mexico cubano
dominicano all the plugs that i know
driving benzes with no benefits
not bad huh for some immigrants
build your fences we diggin tunnels
cant you see we gettin money up under youjay "
0,2.59E+17,2012-10-18 13:14:47+00:00,there are no legal immigrants in greece not one give me a break
0,8.66E+17,2017-05-22 01:46:08+00:00,more undocumented immigrants in us are giving up hope and trying for canada via aflores
0,1.16E+18,2019-07-31 17:22:45+00:00,european immigrants landed at legal entry points exactly how far back are you charting european immigrants to these native lands of united states 
0,1.02E+18,2018-07-19 18:35:20+00:00,an immigrants struggle ana is an undocumented honduran mother of three whose husband is in detention and she is trying to hold her family together in the trump era 
0,9.97E+17,2018-05-18 11:01:21+00:00,yeah cause its not like youve used that type of language to describe mexican immigrants before 
0,1.06E+18,2018-10-30 11:49:32+00:00,i have said since president trump was a candidate the power of the podium is very strong first immigrants than african americans eventually attacking jewish people the bottom will eventually fall out this was my prediction during the candaigns two years ago
0,6.10E+17,2015-06-15 00:18:24+00:00,obama wh illegals from central america not dangerous except for the terrorists who are sneaking in wthem
0,1.59E+18,2022-11-02 11:21:08+00:00,if congress kills social security and medicare we will then become the illegal immigrants and mexico will build that wall even higher
0,1.02E+18,2018-07-16 21:02:44+00:00,"you worried about immigrants when you really should be worried about russians
donald trump is a sleeper cell for the russian government "
1,1.02E+18,2018-07-27 22:10:24+00:00,problem in mexico are the mafias governors police military all receive a share of the 10000 usd they immigrants pay to cross as its in morocco tunisia libia or egypt
1,8.32E+17,2017-02-15 04:04:07+00:00,go back to russia you commie stinking bitch send him back to russia send him back to russia send him back to russia
0,8.79E+17,2017-06-24 20:36:02+00:00,well im and american italian son of immigrants i bleed red white and blue new yorker republican so you tell me
1,8.45E+17,2017-03-25 02:29:24+00:00,if they can use it wpublic toiletpaper dispensers in china then we can use it to track immigrants chinas great right 
0,1.13E+18,2019-05-18 14:18:24+00:00,"lives that conservatives care less about than unborn fetuses
native americans
unarmed black people
actually black people period
children in fostercare
women
poor people
refugees
mexican illegal immigrants apparently an unborn life is worth more than all of these"
1,1.05E+18,2018-10-19 00:41:13+00:00,these illegal immigrants could go to mexico if they were hurting but these people are being paid to only go to the usa by the democrat communist party and by soros president trump stop them president trump stop them send them home send them home
0,9.52E+17,2018-01-11 22:34:31+00:00,the prez wants immigrants from norway read white and doesnt want immigrants from el salvador read brown this is racist 
0,1.57E+18,2022-09-23 21:18:04+00:00,so youre going to require the people from cuba to have visas to come to the united states but youre ok with over 200000 illegal immigrants coming in from the wide open southern border every month 
0,1.44E+18,2021-10-02 14:58:58+00:00,oh yeah did a good warmup set proud to be with event in repping pacific island myself 
0,1.14E+18,2019-06-25 18:18:24+00:00,so it was ok for european immigrants to come but not brown ones ok you told on yourself
0,1.59E+18,2022-11-17 14:18:25+00:00,also i have lived near the us mexico border for almost my entire life and resent the wall and the vicious language used by republicans about immigrants i frequently visit mexico and find demonization harmful to everything from families visiting to trade we can do better
0,1.03E+18,2018-08-09 16:18:42+00:00,ken was this the feeling about the germans the irish the italians the polish why are immigrants of color being singled out save chicago for another time this is racist rhetoric
0,6.32E+17,2015-08-12 21:45:46+00:00,immigrants and china are not taking our jobs wall street is just maximizing profit by finding the cheapest labor sources
0,9.97E+17,2018-05-17 10:19:02+00:00,thursday may 17 the washington post todays headlines critics fear trumps desire for a legacymaking deal eclipses substance on n korea trump refers to some undocumented immigrants as animals at roundtable via 
0,1.43E+18,2021-08-16 22:55:46+00:00,speaking of hypocrisy many of the same people lamenting the plight of the afghan people today have been bashing immigrants and refugees while there are 28 million displaced afghans each year consistency with policy and talking points has never been a republican strong suit 
1,8.17E+17,2017-01-05 18:36:36+00:00,vietnammonarchvictorialuudinh million chinese invaders illegal occupying luxury living buildings in vietnam 
1,1.01E+18,2018-07-05 06:44:40+00:00,and shes out here now screaming in the streets how she wants to bring in more illegals from mexico thatll certainly fix things up
0,8.49E+17,2017-04-04 01:46:09+00:00,monarch victorialuudinh of republic vn demand china prc chinese invaders leave ainamquan north vietnam of republic vietnam nation
0,1.21E+18,2019-12-25 11:59:14+00:00,whether it helps or not its easy to understand why immigrants are inclined to try to help their kids integrate my dad was born in the us but his name was luciano and he only spoke spanish until he started school which were very hard for him so he went hyperamerican with scott
0,1.01E+18,2018-06-19 12:50:38+00:00,these culturally functional former good guy immigrants may rightly turn into deadly us enemiesharm to the receiving nations if recruited into criminal lifestyleeducated english spkwill be more ideal candidates for tco higher power positionsmore likely to be successful at
0,1.13E+18,2019-05-06 01:57:31+00:00,all the embassies in dc are wonderfulbut the philippine embassy is the best grateful thats its asian pacific american heritage month proud of being a daughter of immigrants from the philippines and a woman of color 
0,8.37E+17,2017-02-28 21:35:16+00:00,will loser in chief talk about the hate crime against indian immigrants trumpspeech
1,7.22E+17,2016-04-18 21:42:53+00:00,not disappointed in the liberation of 4 syrian townsvillages from iranian backed invaders
1,1.25E+18,2020-04-21 20:18:11+00:00,its sad when you see a white person who is discussed by immigrants from mexico and not from ireland or europe and those groups are more mob ties from europe and havent worked in the agriculture fields to feed usa
0,7.17E+17,2016-04-04 17:49:27+00:00,europeans r surrendering to tsame invaders who raped pillaged and conquered them 1000 yearsago and were forced 2fight off european soil
0,1.07E+18,2018-12-06 02:47:00+00:00,geraldo forgets that most of the irish german italian immigrants came to the us before welfare reforms they had to find work or starve my grandfather needed a sponsor and skill to come to the us in 1910 geraldo forgets they all came legally and vetted
1,8.10E+17,2016-12-15 23:10:10+00:00,deport them all now or say bye bye to your country forever thats not a joke either australia take ur country back immediately 
1,4.09E+17,2013-12-07 09:07:25+00:00,university of chinese immigrants goodbye friends i am deaaaaaaaaaad
0,1.42E+18,2021-08-01 17:49:33+00:00,oh girl yes there are droves of african and caribbean immigrants in europe a lot of biracial people from when bm where in wwii and had kids with white women
0,1.58E+18,2022-10-01 16:58:24+00:00,doral almost 90 venezuelans is the most expensive city in the south eastern usa pay the highest property taxes in miami dade county all built by venezuelan immigrants never picked crops come visit
0,7.19E+17,2016-04-10 20:29:33+00:00,germany accepted over 1 million immigrants germany and rest of europe will soon see a rein of terror unseen in human history
1,9.53E+17,2018-01-16 06:56:39+00:00,if all americans of all creeds dont wakeup to this daca and deport them then my follow americans fine out later what you reap you sowfor your wages and benefits will never be high you just brought all the shitholes from mexico shalom
0,8.34E+17,2017-02-21 23:53:31+00:00,obama deported millions of latino immigrants as a mexican immigrant none of my family saw him as an ally or chandion fuck you
0,1.29E+18,2020-08-11 20:45:22+00:00,folks a black women who is half jamaican whose parents are immigrants is going to be our next vice president ive never felt more seen in my life
0,1.40E+18,2021-06-01 19:03:55+00:00,another firstgen daughter of mexican immigrants grad proud to be esto es para ti mamá y papá sus sacrificios valieron la pena next stops grad school and a new role as a research associate 
0,1.45E+18,2021-10-21 16:07:05+00:00,"why why workers pursue their careersengineers doctors architects scientists our focus gc backlog end the backlog stop the abuse break the shackles
dont punish indian immigrants by excluding 6000234
durbinisracist
judiciarydems"
0,5.36E+17,2014-11-20 22:27:07+00:00,"native girls are being mass raped in sweden by who declared no white zones sweden needs a revolution too
god speed"
0,1.51E+18,2022-04-11 23:19:38+00:00,no except for russians in their embassies in the us just because someone is russian and lives here doesnt make them complicit in putins dealings in russia per se they may have come here to get away from it all or were born here by russian immigrants
0,8.83E+17,2017-07-05 10:44:07+00:00,immigrants who embraced the american dream work hard learned english fought to be free from tyranny and were proud to be americans 
1,9.98E+17,2018-05-20 03:10:40+00:00,when will germany realize tourist dont want to come to your country on vacationsholidays anymore these immigrants are hurting your tourism 
0,9.53E+17,2018-01-14 22:57:27+00:00,not saying she doesnt know her uncle if king knew about trumps birther movement against obama insulting john lewis a friend of dr king his treatment towards the central park 5 his comment on haitian and african immigrants i doubt dr king would want to be compared to trump
0,1.09E+18,2019-02-07 01:33:06+00:00,lowest number of illegal immigrants crossing mexican border in 50 years 
1,9.05E+17,2017-09-04 07:23:09+00:00,they should go make mexico great with the education americans payed 4 and their parents should be gone already we want legal immigrants
1,1.11E+18,2019-03-15 21:04:12+00:00,start with trump send him back to germany or lying ted cruz from canada or you
1,1.27E+18,2020-05-28 07:18:12+00:00,"go back to mexico theyre stealing our jobs
do it the legal way deport them theyre breaking the law
speak the language this is america the irony "
0,1.35E+18,2021-01-11 19:07:31+00:00,oh shit here we go what about european immigrants or is it cause there all white this is just the start of a slippery slope we wont ever com back from categorizing people and putting them into groups will make it easier to discriminate and create more conflict lol 
0,6.50E+17,2015-10-03 14:42:21+00:00,were being invaded maysville georgia 
0,1.12E+18,2019-05-04 22:20:11+00:00,i dont think mexican citizens celebrate sept 16 at allmost are too busy trying to survive and eatmay 5 is celebrated by immigrants to us because they like corona and tequila and have money to party 
0,1.15E+18,2019-07-01 01:08:13+00:00,a meeting to discuss how to help central america would help both countries the us and mexico use diplomacy aid set up a process in central america for refugees to apply for asylum there like obama did trumps hateful policy is causing all kinds of abuse towards immigrants 
0,1.15E+18,2019-06-30 04:15:30+00:00,fun fact german immigration in the late1800s is one main reasons milwaukee elected three socialist mayors in the early 20th century and they and other immigrants who are still coming made milwaukee a great place
0,1.14E+18,2019-06-06 15:03:30+00:00,i will be there speaking about my immigrant family what we share with current ssylum seekers and why we were able to succeed in america friendly policies towards cuban immigrants landing on us soil have everything to do with it
1,1.17E+18,2019-09-03 16:51:12+00:00,what are these people going to do in europe who going to pay for them these invaders are nothing but trouble makers and nerferiou bad people looking for something for nothing european countries are going to learn a hard lesson about muslims and immigrants 
1,8.54E+17,2017-04-17 18:02:05+00:00,we are behind you all the waywhat about a canadian northern boarderlots and lots of immigrants wanting to get in us
0,8.39E+17,2017-03-07 04:40:31+00:00,taking shelter in laundry room from tornado its two immigrants from the bahamas my boyfriend and i and a guy reading donald trumps book
0,1.42E+18,2021-07-31 06:58:54+00:00,nigeria really let nico mannion send them back to murtala muhammed legit crying
1,1.05E+18,2018-10-23 19:38:20+00:00,mexico offered them asylum and they refused them we have millions illegals immigrants here if we let all these people in more and more will come when is this illegal immigration going to stop people have to come here legally
0,8.39E+17,2017-03-08 11:27:28+00:00,the mass deportation of african immigrants that isnt getting media attention by 
0,1.53E+18,2022-05-22 18:37:01+00:00,the club was formed to help the irish catholic immigrants in the city at the time thats one of the main reasons for why theyre known throughout the world they have a rivalry with rangers the protestant club also from glasgow massive game u should watch that at some point
1,1.05E+18,2018-10-20 19:40:58+00:00,these outbreaks are caused by the massive amount of immigrants from the middle east that have invaded european cities
0,1.13E+18,2019-05-21 00:24:02+00:00,overlooking the fact that current immigrants are central americans not from mexico
0,8.59E+17,2017-05-01 12:02:31+00:00,"go i stand with poland
resist tyranny and reject invaders
god bless poland "
1,1.05E+18,2018-10-21 14:24:50+00:00,make invading our country punishable by death maybe that will stop this or life on a deserted island in the pacific 
0,7.28E+17,2016-05-03 22:44:14+00:00,fact finding trip fact tumbleweeds came from russian immigrants so really they shouldnt be in old western films
0,5.89E+17,2015-04-16 15:32:43+00:00,the board of edu used posters like this to encourage immigrants to learn the language national 
0,8.02E+17,2016-11-25 16:24:03+00:00,america is made up of immigrants from everywhere not just mexico
1,1.04E+18,2018-09-10 07:08:54+00:00,lock obama up send him back to kenya he does not belong in america 
0,1.15E+18,2019-07-16 20:57:52+00:00,white european immigrants like the first lady melania trump are welcomed darkskinned migrants from latin america are put into cages and cands 
1,2.58E+17,2012-10-17 02:40:44+00:00,spanish people are the only immigrants omg fucking ignorant
1,1.05E+18,2018-10-07 04:20:27+00:00,connor lets kill this russian send him back to the buss
1,8.24E+17,2017-01-24 02:32:42+00:00,jeffrey lord dry cleaners dont like nafta because mexican immigrants dont use tandons 
1,1.09E+18,2019-01-25 23:38:59+00:00,free everything for all immigrants release all the prisoners give them the vote lets arrest all the hard working people in america take their possessions and give it all away did i mention surrender to russia china or even france oh forgot isis and the taliban
1,9.64E+17,2018-02-15 00:39:02+00:00,european invaders 
0,8.87E+17,2017-07-17 02:55:58+00:00,monarch victorialuudinh declaration 02142017 communist srv chxhcnvn chinese invaders tortured vietnamese frnguyendinhthuc vn
1,1.16E+18,2019-07-30 14:03:04+00:00,why is ice gonna start rounding up some of these 500000 illegal european immigrants
1,8.28E+17,2017-02-06 04:10:40+00:00,france is getting on the my country first bandwagon theyll follow brexit crackdown on illegal immigrants and elect marine le pen 
1,1.14E+18,2019-06-19 00:24:07+00:00,when 50 percent of americans think your canmpaign coordinated with russia 50 percent want you impeached and 49 percent want biden vs 39 percent for you according to fox news polls 6162019 its hard to decide between provoking war with iran or deporting millions of immigrants
0,8.59E+17,2017-05-01 22:58:18+00:00,as workers and immigrants rise up across the country on we also stand in solidarity with the people of puerto rico
0,5.80E+17,2015-03-23 15:55:25+00:00,they should be thanking aas for the rights they enjoy today rt when do caribbean immigrants become black 
0,8.36E+17,2017-02-25 20:34:10+00:00,monarch victorialuudinh of rvn china invasion chinese invaders illegal invaded ainamquan north vietnam of republicvietnam 
0,1.04E+18,2018-09-25 14:54:47+00:00,zionist invaders stole homes business lands and livestock from palestinian christians muslims and armeniansbahai all non european jews were forced into submission or exile
0,1.03E+18,2018-08-15 19:43:51+00:00,not to worry john brennan is son if irish immigrants from roscommon nothing phases himhe will continue to speak the truth 
0,8.47E+17,2017-03-28 21:14:30+00:00,monarch victorialuudinh of republicvietnam nation chinese invaders illegal invaded marketssupermarkets in vietnam nation
0,1.16E+18,2019-08-09 23:56:34+00:00,yes i agree although as childbirth drops even among immigrants the orthodox jewish experience in new york and israel is worth noting once minorities but swiftly becoming the majority by birth rate and in us loss of ethnic identity among children and grandkids of secular
0,1.26E+18,2020-05-12 00:24:46+00:00,1882 chinese exclusion act for 1st time in us history a group was not allowed into this country on the basis of race chinese people were the first illegal undocumented immigrants chinese either have to leave or find a way to circumvent a law
0,1.24E+18,2020-03-07 23:14:25+00:00,and it was improvements to the design by another immigrant leon moisseiff from latvia a great collaboration between european immigrants made the golden gate bridge a landmark of moisseiff is also known for the bridge 
0,1.16E+18,2019-08-05 08:08:44+00:00,trump says hate has no place in our country and at the same time hes the reason for the hate and deaths he hates immigrants he hates african americans he hates mexicans he spews hates and his supporters eat it up
1,8.26E+17,2017-01-30 23:37:59+00:00,canada feels that all immigrants should be admitted to canada hows that working for you so far
1,1.13E+18,2019-05-23 20:10:12+00:00,someone needs to fix that i think it would be a good relation for mexico to accept all the illegal immigrants that pass our way and as a fine for the number that cross we should also send them illegal chinese and philippian immigrants and mexico can bus or ship them back too
0,1.21E+18,2019-12-24 19:49:56+00:00,this can be laid at the feet ot and people like him that spread hate and bigotry saying theyre bringing drugs theyre bringing crime theyre rapists and some i assume are good people about mexican immigrants is racist at best and encourages racism
0,9.63E+17,2018-02-12 14:36:37+00:00,"absoeffnlutely
crowing about legal immigration from europe prior to 1924 is essentially meaningless as there were almost no laws in place for immigrants to break "
0,1.12E+18,2019-04-28 20:42:14+00:00,you would know all about that with your business sketchy practices wouldnt youjust how much money did you cheat the irs out of immigrants african americans asians jewish native american west africans germansjewish muslims latin dissent pay their taxes not on foodstands 
1,1.04E+18,2018-09-11 07:50:19+00:00,"traitors gonna do what a must to stay alive stop lenient sentences just deport them to russia
torussiawithlove
and too "
