0,1.37E+18,2021-03-14 06:46:13+00:00,"the administration announced
more than 300000 illegal immigrants are being protected the biden administration is granting what is known as temporary protected status to illegal immigrants from venezuela according to a teleconference transcript released by the wh"
1,1.16E+18,2019-08-14 06:53:59+00:00,under new immigration rules he wants immigrants who can speak the language and share our values 
1,1.10E+18,2019-02-18 17:41:08+00:00,that is actually mexicos and americas fault because mexico is letting these illegal immigrants in and not helping america and america is not holding mexico accountable for what theyre doing to america
0,8.26E+17,2017-01-30 06:39:13+00:00,quebec canada l am so sorry this tragedy has happened to you you who where so kind and opened your arms to immigrants
0,1.01E+18,2018-06-20 20:03:59+00:00,when immigrants were migrating to the us it was under british control literally have no idea what you mean here it seems to ignore centuries of us history at best candstheir purposeidkask the president whatever their purpose im opposed to children in cages are you
0,1.01E+18,2018-06-28 16:47:39+00:00,my parents and brother were immigrants from europe 1958 i was just the first person in my family born in the usa
1,1.03E+18,2018-08-05 15:36:56+00:00,send her back to the congo
1,7.22E+17,2016-04-17 21:17:33+00:00,paris a cand of immigrants from afghanistan and north africa broke out into a serious riot this is what open borders will do
0,2.33E+17,2012-08-08 21:48:48+00:00,i think hes referring to that there are flags for most of minnesota immigrants finland sweden mexico germany etc
0,1.08E+18,2019-01-12 07:39:07+00:00,congratulations im very happy for nana this article speaks mainly about legal immigrants illegal immigrants do not qualify for public assistance side note the irish were treated like shit in nanas day think youd be more compassionate
1,1.11E+18,2019-04-02 17:39:46+00:00,another illegal immigrant from honduras murders a nj woman when will it stop wake up democrats 
1,7.96E+17,2016-11-09 04:31:18+00:00,well you arent gonna have illegal frenchman flooding the mexican border theyre illegals from
1,1.04E+18,2018-09-05 22:31:15+00:00,what you need to do is send her back to italy or france or wherever just get her off the show she doesnt need to be there she is just a homewrecker
1,1.51E+18,2022-04-09 19:32:50+00:00,throw cruz out of office hes worthless to america send him back to cuba 
1,1.01E+18,2018-06-23 12:56:17+00:00,we should abolish nafta put 3 army divisions on the border we are under attack america mexico has declared war against the united states we are being invaded
0,6.28E+17,2015-08-04 00:16:51+00:00,watermelon cucumber salad with balsamic reduction and thai basil thanks to for a 
0,8.53E+17,2017-04-14 19:53:55+00:00,monarch victorialuudinh since 1975 chinese invaders illegal collected natural resources and seas property of republic vietnam nation 
0,1.18E+18,2019-10-03 11:55:50+00:00,and when their dna comes back as a native american whos family fled across the border during the indian oppression wars 
0,8.24E+17,2017-01-26 00:35:12+00:00,things are so bad in central america that the immigrants risk the border patrol and drug cartels to get to the usa
1,1.51E+18,2022-04-10 00:59:20+00:00,bus them to canada trudeau is on record as saying canada loves immigrants
0,7.46E+17,2016-06-24 23:47:23+00:00,britain is ridiculous for leaving the eu how you gonna conquest spread your culture everywhere and then panic about immigrants
0,1.41E+18,2021-07-09 00:30:20+00:00,maybe the difference is if that have czech citizenship then they call themselves immigrants
1,1.02E+18,2018-07-31 11:46:02+00:00,what he said about immigrants from mexico is true he said some are good people but he also said that there are rapists gang members and murderers so let me understand this youre saying because theyre mexicans that automatically its racist calling some of them criminals
0,1.20E+18,2019-11-22 04:50:46+00:00,forgot to mention this story will air tomorrow morning on so tune to hear more about this trailbrazing utahn and son of japanese immigrants
0,1.24E+18,2020-03-20 23:05:37+00:00,man is calling us snowflakes and retreating drumpf rhetoric about the chinese flu and how mexicans are all illegal immigrants and were all sitting here with fists full of beer and pizza like 
0,1.08E+18,2019-01-10 03:15:30+00:00,if the immigrants coming across the southern border were white and english speaking this would not be an issue 
0,1.51E+18,2022-03-31 15:03:18+00:00,thank you for your great studies im not surprised that most of the founders of us unicorns who are immigrants were born in israel israelis love the usa 
1,6.44E+17,2015-09-15 12:35:58+00:00,also zero immigrants for qatar dubai uae oman kuwait etc this is pc insanity muslims belong back in the sand
0,6.49E+17,2015-09-29 13:35:18+00:00,equipandtrain willing syrian citizens in eureturn to fight invadersloyalty to const govtrussia candc mil
0,8.55E+17,2017-04-20 18:00:41+00:00,wendy was born here but her parents are mexican immigrants and now shes ready to stand up and make her voice heard 
1,1.14E+18,2019-06-18 23:16:55+00:00,when 50 percent of americans think your candaign coordinated with russia 50 percent want you impeached and 49 percent want biden vs 39 percent for you according to fox news polls 6162019 its hard to decide between provoking war with iran or deporting millions of immigrants
0,8.80E+17,2017-06-27 20:19:40+00:00,monarch victorialuudinh demand chinese invaders move all belonging out of halongbay of republicvietnam immediate 06272017
0,8.26E+17,2017-01-29 01:32:45+00:00,did you know that steve jobs is the son of syrian immigrants do you really share trumps values
0,1.10E+18,2019-02-11 22:37:11+00:00,they didnt want to come here and change americathey learned our language my daughters grandmother is from vietnam i need to explanation she learned english and became a citizenstop trying to stick up for law breakers zero tolerance for illigal immigrants
0,4.84E+17,2014-07-02 00:35:16+00:00,was america not a hub for many european the same people standing at the borders have great grandparents who came here tbc
0,1.14E+18,2019-06-13 20:21:32+00:00,i cant imagine being a daughter of immigrant parents and voting for trump i just cant my parents came from el salvador in the fucking 80s they crossed the guatemala mexico and us border they went thru the rio grande how could you be a child of immigrants and support trump how
0,1.40E+18,2021-06-03 13:47:23+00:00,america was built by immigrants if you are not native american are mexican you are descended of immigrants trumps surrounded by asylum immigrants his wife and his mother and inlaws 
0,8.92E+17,2017-07-30 20:57:00+00:00,toxictrump is a send him back to russia 
0,1.30E+18,2020-09-02 01:01:47+00:00,is there a problem with catholics i come from irish catholic immigrants settled here in 1848 steadfast democrats who believed in the church the democratic party and opportunity
0,8.36E+17,2017-02-26 16:31:13+00:00,macys dropped president trumps suits shirts and ties two summers ago after he called mexican immigrants killers 2
0,8.43E+17,2017-03-17 07:21:55+00:00,so youre ok with immigrants and kinship but only if theyre european and not hispanic or muslim right hypocritical asshole
0,8.96E+17,2017-08-11 15:07:32+00:00,talking mental health care for immigrants dr luis garcia of pacific clinics speaks on familyfocused intervention 
1,1.04E+18,2018-09-08 00:35:43+00:00, are good ppl takes babies away frm parents falsely claims dems want open borders and makes it seem like latinos seem like bigger criminals false falsely leaves off most illegal immigrants come from mexico when 40 of illegals come from ppl flying in and over staying their
0,1.08E+18,2019-01-04 20:29:16+00:00,as a matter of fact i teach immigrants legal or illegal how to speak the language these big criminals are former doctors and lawyers who fled their countries in order to survive
0,1.21E+18,2019-12-29 02:17:22+00:00,shaveice was a favorite cool treat of immigrants toiling in sugar and pineapple fields japanese laborers had brought the traditional as and likely dating back to japans heian period 7941185 adwith them to oahu 
0,8.26E+17,2017-01-30 15:53:49+00:00,of the illegal immigrants coming in how many are mexican arent more from central america trumps focus is wrong on many levels
0,1.49E+18,2022-02-04 21:14:20+00:00,he seldom discussed social issuesnow flores who is black and the son of honduran immigrants is an unlikely figure at the center of the nfls latest racial reckoning 
0,1.07E+18,2018-11-28 17:11:36+00:00,my other greatgrandparents came from poland because of wwi at the time those countries were dealing with poverty and violence polish and italian people werent seen as desirable immigrants and werent seen as white either things change but people still seek safety here
1,1.02E+18,2018-07-06 13:16:05+00:00,ignore current events and all the immigrants legally and illegally crossing the border to get into this terrible place it isnt happening venezuela cuba or n korea
1,9.31E+17,2017-11-16 02:07:11+00:00,im told there is a large number of russian immigrants some with kgb ties who are now i in our eastcost police force if true its a potential problem
0,9.53E+17,2018-01-15 16:37:08+00:00,like klobuchar and dayton sen tina smith criticized trump condemning his racist and hateful comments that showed complete disrespect to immigrants from haiti and africa
0,1.44E+18,2021-09-24 19:46:20+00:00,"can you imagine that
the government start
telling us what they do
to illegal immigrants
i have a legal friend
from turkey
he spent more than six months in an immigration
facility in new jersey
because his student visa
expired every immigrant
case is treated differently "
0,7.32E+17,2016-05-15 22:37:53+00:00,if he didnt say mexicans are rapists he clearly said that mexican immigrants are rapists no 
0,9.93E+17,2018-05-05 17:43:02+00:00,and by the way assuming you live in texas your economy would collapse were it not for immigrants doing all the work you wont do just see how well california is doing 5th largest economy in the world based on gdp after us china germany and france
0,4.44E+17,2014-03-12 07:00:48+00:00,even if the europeans agreed to help does ethiopia want rastafarian immigrants 
1,1.22E+18,2020-01-15 06:15:01+00:00,oh y trmplives the russian and like but they hate us or the other immigrants
0,1.10E+18,2019-02-17 07:44:59+00:00,found terror activity and radicalisation as major challenges posed by illegal immigrants many of them live in metropolitan cities across india doing menial jobs recent terror arrests and mob violence involving them point to a developing tinderbox situation 
0,9.52E+17,2018-01-12 02:59:26+00:00,if all caribbean and african immigrants and our children returned to our birth countries america would experience a very painful brain drain they should carefully think about what theyre praying for
0,1.50E+18,2022-03-09 14:37:53+00:00,i met a lot of ukrainian and russian immigrants working in various business around breckenridge co support for ukraine was displayed on flag poles lapel buttons signs in storefront windows and on the window of the cleanest tesla model 3 ive ever seen during snow season 
1,1.35E+18,2021-01-21 22:11:09+00:00,brand new chinese virus pandemic arizona 65 devastated by mutated virus from mexico guatemala and nicaragua limits on ice lets illegal immigrants spread out thru america 
0,9.82E+17,2018-04-06 01:05:21+00:00,id recommend a very good book which explains how many european immigrants were vilified and deported for being poor and needing charity it completely destroys this fox news argument 
0,1.07E+18,2018-11-26 01:44:14+00:00,this is stupidity by violating international law shooting gas to children and babies not allowing the asylum process these immigrants are seeking crazy trump americans now being held in mexico and can not get home big mess
0,7.40E+17,2016-06-07 01:12:53+00:00,now republicans are worried the day trump announced he was running he called mexican immigrants rapists
0,9.04E+17,2017-09-02 00:49:25+00:00,is shocked there are immigrants in jersey
0,9.52E+17,2018-01-12 03:06:07+00:00,dear marco i can confirm that haitian immigrants and africans were hurt today by racist comments why you were weak
1,6.93E+17,2016-01-29 03:08:05+00:00,secure the border but 40 of illegal immigrants arrive on airplanes what about the pacific the atlantic canada 
1,1.17E+18,2019-08-23 23:12:42+00:00,blame the fed blame the chinese blame the immigrants blame the kneeling blacks blame jewish democrats blame the nasty women just dont blame the chosen one donald trump
1,4.60E+17,2014-04-27 01:05:11+00:00,in phoenix az the middle east terrorist population was moving into the us as immigrants through mexico
1,9.52E+17,2018-01-13 17:26:43+00:00,43 of immigrants from shithole african countries have a bachelors degree or higher compared to 33 of the overall american population nigerian americans for instance have a median household income well above the american average 
0,1.39E+18,2021-04-30 16:05:39+00:00,i know the ri immigrant experience because i lived it my family and i came to america from the dominican republic when i was 20 after a brief time in new york city we moved to providence it was the best decision we made writes lgsabinamatos 
1,1.09E+18,2019-01-30 19:10:32+00:00,trump russia is the real threat disrupting our democracy and elections americans are lookin at russia as the invaders
0,1.03E+18,2018-08-21 17:29:24+00:00,i am disgusted to hear she is looking into the poor children from another country help the immigrants get their families back feed our hungry kids help with the opioid crisis help the children of puerto rico etc etc
0,1.32E+18,2020-11-04 02:19:39+00:00,once again there might indeed be a uniform swing but the reasons for any underperformance among latinos would be as a result of a lack of engagement with these communities not because miami cubans and mexican immigrants are the same 
0,1.05E+18,2018-10-22 13:16:12+00:00,the republicans and their saudi and russian allies are really rather weak and obviously quite emasculated or theyd come straight out and say they want to kill the gays and gas the immigrants and kill off anybody else at will no backbone enjoy
0,4.29E+17,2014-01-30 16:55:14+00:00,im about to get this class discussion poppin in english class last time we talked about racism immigrants and terrorism im ready
0,8.25E+17,2017-01-27 21:51:09+00:00,why did he ban people from france uk russia egypt and pakistan
1,9.89E+17,2018-04-24 23:41:37+00:00,enrique speak the language first and then be thankful you are here in america americans will welcome immigrants that enter legally not responsible for every human on earth especially immigrants entering illegally i spent 22 yrs of my life defending this country not 4 illegals
0,8.26E+17,2017-01-31 04:00:05+00:00,"
see japan australia denmark sweden and rising problems in uk
"
0,7.63E+17,2016-08-09 16:18:42+00:00,beautiful and peaceful vinegar hill so named in the 1700s to attract the irish immigrants 
0,1.09E+18,2019-02-06 17:55:38+00:00,back since when were we socialist perhaps rescind all the accomplishments of the great society and the advances of the new deal trump vision turn usa into a 01 tax haven replace central america immigrants with russian oligarch tax dodgers 
0,1.15E+18,2019-07-03 20:16:30+00:00,intriguing work by mah wife showing a significant overall in perceptions of discrimination in health care 64 among latinx immigrants and patients even post 2016 election however no change for african americans there is much work to do 
0,1.16E+18,2019-08-14 01:20:03+00:00,has now moved on to china is in real danger of being invaded
0,1.11E+18,2019-03-24 18:51:24+00:00,this also answers trumps question about why we dont get more immigrants from norway 
0,1.40E+18,2021-06-15 04:53:52+00:00,thank you for acknowledging it and taking the time to respond as an afro cuban daughter of immigrants we too want to be seen the movie is indeed a giant step but we are tired of the invisible platform
0,1.12E+18,2019-04-10 13:59:40+00:00,which is why immigration reform is needed not condemning a singular race of people mexicans when you can find statistically at that only 13 of immigrants are actually coming from mexico anyway the points are flying over your head probably
1,1.52E+18,2022-04-21 16:34:49+00:00,throw cruz out of office for his part in the insrection of our capital send him back to cuba and then on to russia with trump and family 
0,1.17E+18,2019-09-13 00:19:49+00:00,to immigrants briley makes his strongest statement about supporting them notes that 11 of 12 mnps valedictorians last year couldnt speak the language when they started school
0,1.01E+18,2018-06-22 01:19:08+00:00,i find corey very uncaring and unfeeling sad even if germany did treat them worse is that a justification for us to treat immigrants bad
0,7.84E+17,2016-10-05 14:59:56+00:00,ive only been once i spent a week there and met only a handful of english english otherwise immigrants outnumber heavily
0,8.49E+17,2017-04-05 02:07:16+00:00,we will be at 8 washington mews tomorrow from 57pm for the screening of in between a short film on bangladeshi immigrants in madrid
0,1.30E+18,2020-09-09 04:36:27+00:00,and what would you do with a government plan if you are not able to vote and even if you were allow to vote why would you choose trump if for exandle the tps for venezuelan immigrants was vetoed by republicans and mainly trump himself legal permanent residents dont vote
0,1.57E+18,2022-09-22 08:54:49+00:00,"immigrants vote
immigrantsarewelcomehere immigrants families vote
except for we are all clue to the clueless native americans fled to mexico to escape the genocide in the us "
0,7.76E+17,2016-09-15 02:08:36+00:00,mexico wants to build a border wall with central america via 
1,9.87E+17,2018-04-19 23:56:09+00:00,4 immigrants are not illegal aliens people like your mother are illegal aliens people like your nudie model wife who work here illegally need to be returned home mexico is our ally and friend russia and the ukraine are not we are a democratic country
1,6.69E+17,2015-11-23 05:16:34+00:00,"rt klsouth
100 of rapes in norway are committed by muslim immigrants "
0,6.96E+17,2016-02-06 13:09:36+00:00,never flown or seen a mexican flag flown in my family we are americans no problem with immigrants just be legal
1,1.01E+18,2018-06-20 09:44:26+00:00,im sure immigrants would be working in a norwegian restaurant too it would be best if she stay out of all dc restaurants
0,1.14E+18,2019-06-24 23:55:03+00:00,not unlike japanese americans being raided during wwii kicking down doors and rounded up trump plans to do the same thing to asylum seekers and immigrants this is what trumps racist white america has come to republicantrumpismfalls 
0,1.15E+18,2019-07-15 17:37:24+00:00,who also might i add are not immigrants mexican people are native american people 
1,1.06E+18,2018-11-05 00:02:43+00:00,dirty bastards can thank pres obama and his evil bitch hillary for leaving ukraine to fend for themselves against russian invaders who took the crimea while he and hillary were tweerking huma 
0,1.12E+18,2019-04-14 12:44:47+00:00,warms my heart immigrants made st louis since the french fur trappers and we are all the better for it send us more we have plenty of room 
1,9.98E+17,2018-05-20 23:59:45+00:00,jordan peterson immigrants are automatons culturally programmed to behave as robotic exemplars of the society that produced them rather than human beings capable of independent thought also peterson we must defend individual liberty from the invading collectivist hordes 
0,6.69E+17,2015-11-24 10:49:01+00:00,"nato shut down russian front line bomber over syria
nato invaders killed pilots
1submit2isis
2start vaporizing
natocapitals
russian choices"
0,8.27E+17,2017-02-01 19:58:56+00:00,i ended up in a heated discussion with a racist us cab driver about muslim immigrants in europe so now im waiting for a new cab
1,1.22E+18,2020-02-03 22:10:58+00:00,judicial watch illegal immigrants buy rent kids for easier us entry guatemalan with fake son jailed 
0,9.58E+17,2018-01-29 22:43:42+00:00,trump called african countries shitholes and said hed rather have immigrants from norway the whitest country in the world tell my thats not racism
0,1.08E+18,2018-12-29 22:29:02+00:00,no wall im a californian for sanctuary cities if you are not 100 native american indian you came from immigrantsif you dont want to live in our melting pot called america go back to your country of origin if theyll let you lets face it youre not welcome here