0,1.17E+18,2019-09-08 04:35:18+00:00,african and indian immigrants are the most educated in the us but that doesnt reflect the literacy of the individual countries themselves
0,1.01E+18,2018-06-18 17:28:21+00:00,lifestyle god creation in their lovely home territory call southern cameroons now federal republic of ambazonian yet these peace loving people have unconscious unwelcome invaders la republique du cameroun or republic of cameroon in their the lifestyle of the people crushed 
0,1.33E+18,2020-11-07 16:36:47+00:00,and a daughter of jamaican immigrants so proud 
1,8.24E+17,2017-01-25 00:52:40+00:00,president trump will ban immigrants from syria and six other dangerous muslim countries by signing an executive order tomorrow
1,1.26E+18,2020-05-24 21:28:28+00:00,so the portuguese men who were immigrants is the bigger story than the crime they committed to cheryl at big dans tavern
0,7.44E+17,2016-06-19 04:54:38+00:00,billionaires got your cash and the chinese got your jobs dummy the immigrants just got here where u been
0,4.41E+17,2014-03-04 14:10:49+00:00,in israel immigrants are humans prez
0,8.71E+17,2017-06-02 06:24:02+00:00,"immigrants founded 51 of us billion dollar startups india 14
canada 8
uk 8 israel 7
germany 4
france 2
ireland 2 "
0,1.07E+18,2018-11-26 01:51:52+00:00,are you kidding me this is the most ignorant an asinine comment i have ever read on twitter entire native civilizations were destroyed by invading european immigrants it was long enough ago that you do not need to apologize for it but dont pretend it did not happen
1,1.26E+18,2020-05-10 22:03:18+00:00,the solution to this problem is for all the israeli invaders to go back to europe or wherever the hell they came from you are not from here nor are you welcome
1,6.41E+17,2015-09-07 13:31:47+00:00,do you know what they do to illegal immigrants in mexico they jail them and then deport them
0,1.18E+18,2019-10-17 20:09:37+00:00,company volunteer day so i chose to work with to write letters of support to immigrants detained in georgia 
1,8.68E+17,2017-05-25 15:09:42+00:00,germany can support millions of muslim invaders but refuses to pay its nato bill usa needs to stop paying the entire bill for nato
1,1.49E+18,2022-02-17 17:13:34+00:00,it matters to did the say immigrants from mexico made the country dirtier
0,7.96E+17,2016-11-08 14:23:28+00:00,3 generations of jamaican immigrants we voted for the american 
1,1.18E+18,2019-09-24 17:39:29+00:00,french people better wise up before its too lateyour government invited these bastards to your country now you figure it out always talking shit about not being prididish country now live with these invaders and nerferiou bad people 
0,9.28E+17,2017-11-09 01:47:17+00:00,"what was the final vote count difference between northam and gillespie right nowin every state democrats are revising their platform
russia collusion
illegal immigrants
no voter id
mass voter registration in urban areas
scream racism
give felons right to vote "
1,9.14E+17,2017-10-01 00:13:22+00:00,good work send them back to the southern border of mexico chances are we wont see them again
0,9.80E+17,2018-03-30 09:50:33+00:00,president trump please stop the deportation of immigrants who came here to make money for there families i know spanish and i talk to them and they have not done nothing wrong but show up to work on time i know the construction field its not easy 
0,6.77E+17,2015-12-16 01:58:18+00:00,bro you cant both be a son of cuban immigrants and mr haney from greenacresdecide
0,8.34E+17,2017-02-21 06:32:36+00:00,birdshotandbullshit texas hunters indicted after shooting each other then blaming mexican immigrants 
0,1.41E+18,2021-06-30 00:12:11+00:00,only white people want him to be a nger nger means an african stripped of culture in america for white supremacist purpose a generally announced death warrant a label upon immigrants and sellouts aim to assimilate to white authoritys amoral concerns 
0,6.87E+17,2016-01-11 17:57:45+00:00,trumps mother was scottish father german wife slovanian all immigrants yet he questions others citizenship hypocrite
0,1.51E+18,2022-04-11 22:19:20+00:00,"live
talking news politics entertainment
tonight ukrainian refugees with mayor mario m kranjac englewood cliffs nj son of immigrants new jersey native the arthur aidala powerhour radioarthur abklaw "
0,1.10E+18,2019-02-19 16:55:01+00:00,"i work with so many self made immigrants from mexico el salvador guatemala etc
i know asians arabs jews africans all with successfull careers or businesses they arent crying about oppression theyre working hard every day taking advantage of lifes opportunities"
1,1.13E+18,2019-05-18 16:22:53+00:00,"more proof that this country would be better off without
california send them back to mexico"
0,1.14E+18,2019-06-24 23:34:47+00:00,"demonizing immigrants is not new
some demonized irish
italians
chinese
when they came here
america is better off when we welcome immigrants it is a process problem fix the process "
0,9.33E+17,2017-11-20 23:37:35+00:00,just my opinion but i think it is very possible orchestrated the attack on the 2 border patrol guards to renew calls for his stupid wall plus the 1 who died was mexican and has made his feelings toward immigrants very clear would not put it past him
0,1.59E+18,2022-11-03 23:48:17+00:00,"absolutely and he should lead the implementation of the law of ice and arrest the ceos executives and shareholders that profit from the labor of illegal immigrants
iowa has majority chinese and brazilian owned meat processing plants shut down the food industry"
1,6.18E+17,2015-07-06 17:01:14+00:00,i am sure my great grandfather heard the same about the damn irish immigrants
1,9.62E+17,2018-02-09 12:48:07+00:00,this piece of shit palestinian woman linda that lives in ny she is in a country that has been built by white christian everywhere her kind r majority those places r shithole just remind her send her back to where her parents came from she would appreciate what the white have done
0,9.93E+17,2018-05-07 00:11:49+00:00,33 they continuously bully minority enclaves they tried doing this in irvine but all the chineseamericans along with immigrants from south korea mexico india and some white people shut it down hard 
1,5.33E+17,2014-11-12 20:20:28+00:00,"john mccain and obama want more money for
mercenary invaders in syria ronpaulinstitut
"
1,7.75E+17,2016-09-11 02:13:21+00:00,mexico helping unvetted african migrants to us border many from alshabaab terror hotbed 
0,9.75E+17,2018-03-17 16:36:04+00:00,guinness is celebrating its 200th in the us but festivities have taken place here longer than that the nyc parade started with irish immigrants in 1762 and its one of my fav st pats traditions what are your traditions heather guinness correspondent 
0,4.77E+17,2014-06-12 15:04:22+00:00,remains optimistic that african americans and immigrants can advance together
1,1.21E+18,2019-12-27 20:29:46+00:00,exactly what german population or faction made those statements invaders from the middle east that merkel and co aka soros paid 2 have allowed n2 germany who r not german by birth generational or legacy somewhere else
0,1.10E+18,2019-02-24 23:13:00+00:00,locus of control is opening this thursday 4 nights only come see work about the lives of filipino immigrants in america an excellent mix of poetry storytelling 
0,1.08E+18,2019-01-03 06:59:33+00:00,hey what about the canadian wall whos paying for that unless youre only specifically choosing the southern border for specific immigrants enlighten us
0,9.83E+17,2018-04-07 16:38:51+00:00,germany is in crisis when young women are harassed and taped every day by invaders they are scared to go out always have to go in groups and look over their shoulder
0,1.51E+18,2022-04-01 12:52:19+00:00,ukrainian officials say they are not getting the weapons to the front line troops that the biden administration promised ukrainians need these supplies to kill the russian invaders wakeupamerica 
1,1.11E+18,2019-03-15 12:45:05+00:00,"unfortunately there is a lot to point at islam hates us
muslim ban
immigrants dirty invade infest
syrian refugees dangerous send them back
lock your doors somali immigrants dangerous
dancing on 911
etc right wing says and spreads this they should realize how bad it is"
0,1.09E+18,2019-02-09 22:10:37+00:00,european leaders wanting to show compassion allowed antisemites posing as into their countries jews will be fleeing to and these same euro heads want 2 shrink israels borders back to indefensible 1967 levels no
0,7.56E+17,2016-07-20 02:06:15+00:00,donald jr is puerto rican trump loves immigrants
0,7.69E+17,2016-08-27 07:35:12+00:00,haitian immigrants for trumphillary and bill stole billions from haiti 
0,1.11E+18,2019-03-16 18:35:06+00:00,1 australian senator blames immigrants for attacks on mosques 2 teenager smashes an egg on senators head while he gives an interview 3 senator punches a 17yearold kid 
0,1.45E+18,2021-10-26 17:21:42+00:00,please support our afghan allies by cosponsoring the special immigrants visas for afghan fulbright scholars act hr5482
0,8.48E+17,2017-03-31 04:55:46+00:00,monarch victorialuudinh demand china prc chinese invaders pay money to republic vietnam nation for property loss damaged 
0,8.47E+17,2017-03-30 00:57:59+00:00,cuba opened trial of bay of pigs invaders
1,9.21E+17,2017-10-20 03:31:08+00:00,true then we deport them back to mexico and 2 days later they are caught trying to enter us again only way to stop them is a tall wall
0,1.57E+18,2022-09-15 12:11:33+00:00,dear foxnews imagine how much better your reporting would be regarding illegal immigrants if you sent someone who actually spoke spanish to cover the story listening to someone who speaks spanish like a dyslexic kindergartner is painful and annoying thanks 
0,3.21E+17,2013-04-08 21:00:42+00:00,pretty sure im a certified restaurant mexican speaker like i can speak enough spanish to communicate with employed immigrants
0,1.07E+18,2018-12-02 02:58:26+00:00,that reminds me that epiphany is coming and many of the teenage male progeny of the greek immigrants who made their way to tarpon springs fl just a few miles from me will be diving onto what is regarded as frigid water in the gulf of mexico to fetch a cross that someone threw
0,1.03E+18,2018-08-20 16:20:13+00:00,and i also felt like i had suddenly become a representative of my people which meant i had to succeed lest everyone look down on all mexican immigrants its an irrational thought to have but a sentiment that i still experience to varying degrees even today
0,1.36E+18,2021-02-21 12:43:51+00:00,hendren now an independent said his departure from the gop was years in the making highlighted characterization of mexican immigrants as rapists ridiculing of a gold star family mockery of john mccain and encouragementof racism nationalism and violence 
1,1.17E+18,2019-08-24 07:39:04+00:00,nuke china send them back to the stone age
0,9.02E+17,2017-08-26 23:29:27+00:00,arpaiopardoned his parents were italian immigrants
0,9.98E+17,2018-05-20 17:20:35+00:00,my grandfather died an illegal immigrant from ciudad juarez mexico earned several degrees spoke 7 languages he retired in the states never fed off the system never was arrested it bothers me how much politicians feed off of immigration to pull votes from the far right 
0,1.01E+18,2018-06-21 00:01:24+00:00,america has being invaded since years and years ago what are you people talking about all those european people have invaded the indians since years and years before
0,6.94E+17,2016-02-01 23:49:22+00:00, syrian immigrants get sameday health coverage and free visa cards an apartment in jacksonville florida
0,1.07E+18,2018-11-21 08:51:50+00:00,"chinarulesbypropaganda hollywood produced a remake movie that depicted the us being invaded by china chinese found out used economic and other pressures and had chinese soldiers digitally replaced by think about it
"
1,1.58E+18,2022-10-02 00:43:48+00:00,these are immigrants escaping back into mexico after jan 6th 
0,1.13E+18,2019-05-31 02:53:44+00:00,look president trump that president lopez obrador has excellent presidential diplomatic skills that you lack learn from president lópez obrador to be diplomatic stop trying to blame méxico for your ineptness with immigrants needs they are asking for your help and you shut 
0,1.03E+18,2018-08-29 17:33:00+00:00,does miller have any statistics of how many immigrants have committed crimes like murder or drug trafficking it appears most immigrants are fleeing life threatening dictatorships like millers greatgreat grandfather a desperate refugee who fled armed cossacks in belarus to us
0,1.08E+18,2018-12-30 03:48:39+00:00, please provide exandles of radical islam threatening the us from the mexican border you are a cowardly sycophant with no integrity most illegal immigrants come here legally opiod crisis caused by big pharmaceutical anddocs 
0,1.46E+18,2021-11-03 15:45:39+00:00,fish and chips in the first image isnt british the dish was introduced by sephardic jews to accommodate for shabbat in a land where most of the food wasnt kosher to make matters worse the national dish of the uk is actually chicken tikka masala by bangladeshi immigrants
1,1.30E+18,2020-08-18 23:42:40+00:00,i dont think these immigrant blacks from the northeast fit in with blacks from the midwest and southits a way different upbringing being a migration north kid from parents who were both raised in segregation vs someone who comes from caribbean or african
0,1.01E+18,2018-06-20 15:44:55+00:00,stephen miller the architect of trumps zerotolerance policy towards immigrants is an american because his ancestors emigrated to the us to flee persecution in belarus is total lack selfawareness a treatable mental illness
0,1.21E+18,2020-01-06 21:54:26+00:00,rod is correctthey cant send him back to vietnam and that makes everything else cake welcome home brother
0,1.08E+18,2018-12-24 03:28:04+00:00,immigrants coming through mexico less than india and china china attacks us daily via cyber warfare how are their immigrants any less a threat how is the wall going to stop them
0,1.45E+18,2021-10-21 16:41:41+00:00,"this is not fair indian immigrants lives in america is being devastated by your political games stop now we want to trust you but your actions lie
dont punish indian immigrants by excluding 6000234
durbinisracist
judiciarydems"
0,1.18E+18,2019-09-29 19:49:18+00:00,american immigrants always respected our laws and tried to become part of the american tapestry first by learning english as they are countrymen who immigrated to america before them welcome
0,1.14E+18,2019-06-28 12:35:51+00:00,if we were facing a normal political foe it might be different trump and his voters only know make america great again by being hard on immigrants abortion keeping african americans in their place the list is endless lets see if the younger crowd moves the needle
0,9.56E+17,2018-01-23 19:04:16+00:00,trump is wrong norwegian immigrants are not better than haitians for the us economy 
0,1.02E+18,2018-08-02 03:28:58+00:00,my friend take these traumatized kids to summer cand in el salvador honduras nicaragua guatemala or mexico then watch them smile when they are brought to a ice facility for summer cand as illegal immigrants who will vote republican anyway next summer
1,1.57E+18,2022-09-12 21:24:10+00:00,i love him freedom from the english invaders my great grandfather and a third cousin had the same ride to get here
0,7.31E+17,2016-05-11 23:54:23+00:00,"would be unffair for all americas
continent
to not interacts with
the americas country
and canada should also stop
obsorving immigrants"
0,1.52E+18,2022-04-22 15:42:41+00:00,my dad def checked his yearbooks to be sure also tiny fun fact he went to south shore hs in the middle of a demographic shift from mostly white eastern european immigrants kids to mostly black so this is his senior yearbook cover in excruciatingly low res 
0,1.02E+18,2018-07-10 20:27:56+00:00,so trump calling mexican immigrants murderers and rapist doesnt open the flood gates for this type behavior some of whom arent even mexicans and some of whom are hard working citizens right
1,7.41E+17,2016-06-10 21:57:10+00:00," all mexican immigrants rapists
justice dept sued his company 2x for not renting to black people
never renounced david duke"
1,8.27E+17,2017-02-01 14:14:28+00:00,chancellor of germany has her own problems with refugees immigrants 
1,9.65E+17,2018-02-16 22:29:48+00:00,you have no right to your opinion you broke the law and encouraged illegal immigrants to over throw the government you have turned against american people worked with the fbi to plant russian lies against out president trump the winner
0,8.34E+17,2017-02-21 03:42:27+00:00,no mms texas hunters indicted after shooting each other then blaming mexican immigrants 
0,1.10E+18,2019-02-16 13:24:57+00:00,when we talk about illegal immigrants everyone thinks of mexico no one thinks of the canadian border which more immigrants come over from there than mexico drugs ppl etc this is a political movement a wall security votes its all really stupid to me
0,1.48E+18,2022-01-16 10:37:05+00:00,why do south american immigrants that crossed even more borders not have this afinity towards the usmnt
0,1.01E+18,2018-06-10 14:22:12+00:00,serious question has the usa ever revoked someones citizenship andor exiled them to another country could we do this to trump send him back to his boss in russia and never let him return
0,9.49E+17,2018-01-04 13:59:25+00:00,in sinclairs the jungle the protagonist is injured in a meat plant and fired sinclair likened the conditions for european immigrants to slavery only there was no difference in color btwn master and slave a century later the racial component is back 
0,1.24E+18,2020-03-13 01:30:35+00:00,and then theres the chinese workers in spain 
1,2.07E+17,2012-05-29 14:00:01+00:00,shipping containers pit west african immigrants against bronx neighbors 
1,7.97E+17,2016-11-10 04:31:48+00:00,france needs to get tough with sharia law invaders they allowed into their country we have a leader now
0,8.43E+17,2017-03-18 17:10:47+00:00,monarch victorialuudinh of republicvietnam demand china prc chinese invaders leave ainaquan north vietnam of republic vietnam nation
1,1.11E+18,2019-04-04 06:15:04+00:00,if mexico doesnt help out rightquick by keeping the illegals from getting to our southern border it is time to cut our to mexico too 
0,1.59E+18,2022-11-01 19:46:57+00:00,day of the dead combines ancient aztec customs of celebrating ancestors with all souls day a holiday that spanish invaders brought to mexico starting in the early 1500s
0,8.70E+17,2017-05-31 14:15:31+00:00,got my dna results 48 european jewish 19 ireland 33 european other makes sense dad came from austria mom was irish immigrants 
0,1.07E+18,2018-12-14 21:37:17+00:00,wouldnt that depend if the immigrants were more or less susceptible to the disease for exandle mexico has higher measles vaccine rates than us immigration from there isnt likely to increase vulnerability to measles
0,7.55E+17,2016-07-19 13:48:19+00:00,donald trump wants to ban immigrants who have a better grasp on the language than his own wife let that sink in for a sec
0,1.42E+18,2021-07-16 19:47:58+00:00,for some children of immigrants african american doesnt fit their unique black experiences in the us 
0,9.81E+17,2018-04-03 21:47:57+00:00,yeah spend more of our tax dollars from people that are from honduras where many other countries have taken in hundreds and thousands youre not a threat to us another shooting just took its not immigrants shooting its americans
1,1.05E+18,2018-10-23 17:00:03+00:00,tommy is the only hope for great britain good job keep england safe from foreign invaders 
1,1.06E+18,2018-10-31 14:45:26+00:00,which raises the question if the us would put the immigrants marching north on buses and drive them to the canadian border would they welcome them with open arms
0,1.27E+18,2020-06-15 16:57:38+00:00,right but then the response is why should i have to be punished for something other white people did i find this response happens especially with decendants of italian and irish immigrants who were also discriminated against when they came to america
1,9.97E+17,2018-05-17 23:15:59+00:00,this is a waste of time and money im surprised that they arent complaining about his comment that mexico isnt doing anything to stop illegals from getting to our border1 
0,1.03E+18,2018-08-07 21:06:55+00:00,making immigrants great again another baby nordstrom was founded in 1901 by swedish immigrant johan nordström he came to the us with 5 and worked years and years in the mining and lumber industry also in the klondike gold rush in 1897 before opening this business 
0,8.90E+17,2017-07-26 19:46:17+00:00,dislike ppl who scorn immigrants 4 only knowing their native tongue yells at cats constsntly to speak the language
0,8.24E+17,2017-01-25 16:22:17+00:00,the last time bush jr tried to build a mexican wall he used illegal immigrants on the construction crews
0,1.53E+18,2022-05-21 04:22:56+00:00,and give up all that beautiful tasty mexican chinese italian food my friend its he nuts legal immigrants normally bring benefits and knowledge to the country that adopt them
1,1.15E+18,2019-07-16 02:03:45+00:00,eric werent you cleaning the restrooms at city hall last week now you are mayor of the city of lost assholes just gps your ass to mexico take all the invaders wyou 
0,9.52E+17,2018-01-12 16:32:31+00:00,as of 2013 38 of subsaharan african immigrants had bachelors degrees or higher compared to 28 of all us immigrants and 30 of the us born population ill take your next defense please 
0,1.13E+18,2019-05-07 11:42:30+00:00,what it does is make you a normal dumbass amerikkkan cultural appropriator who are celebrating the defeat of dumbass french invaders wish the native population had done the same to you pale faces 
0,7.96E+17,2016-11-09 03:45:14+00:00,meanwhile canada is preparing for us immigrants 
0,1.58E+18,2022-09-30 18:27:31+00:00,im a 7th gen texan my family was part of a wave of german socialists that settled texas hill country during the springtime of nations in the 1840s this wave of german immigrants were the original base of the republican party and they nearly kept texas out of the confederacy
0,1.09E+18,2019-01-28 14:18:32+00:00,only small percent of illegal immigrants in usa entered illegally via mexico that cost doesnt reflect just mexicans
0,7.07E+17,2016-03-09 02:33:14+00:00,how is building a wall to block immigrants from mexico getting into the usa great
1,8.38E+17,2017-03-05 11:35:02+00:00,sweden has a hostile taken over happening by immigrants wake up and protect the people 
0,6.41E+17,2015-09-08 19:58:19+00:00,like how rest of europe are aware of the refugees and decided to welcome with open arms while our system is to kick out immigrantssmh
0,1.01E+18,2018-06-17 01:56:59+00:00,yes mr lieui am angry as hell every single day every single day i think about what an shitshow we have in the wh it never ends someone has got to do something americans are terrified we will end up like germany we are terrified for minorities for immigrants glbtq
0,1.08E+18,2019-01-11 05:18:44+00:00,not only that but the agent speaking to the president spontaneously offers up info dems werent expecting the numbers of noncentral and south american immigrants is higher than those from central and south america 
1,1.02E+18,2018-07-21 00:11:18+00:00,so if hrc let someone break into your home and gang rape your dad then let him suffocate in smoke u let immigrants from libya in 
0,8.04E+17,2016-11-29 16:49:33+00:00,dan is cuban and his parents are cuban immigrants
0,9.45E+17,2017-12-24 16:37:52+00:00,that might be true no way i could know i have met plenty of indian immigrants people who have adopted american names nick lou etc
0,1.28E+18,2020-07-07 15:29:58+00:00,fern cunninghams contribution celebrates the diverse history of mattapanatop the sculpture a young family illustrates mattpans current population consisting largely of africanamericans and caribbean immigrants photo blackhistory 
0,1.10E+18,2019-02-27 03:59:03+00:00,reparations to the original slaves not enough sir or lady lets do reparation for women who get less income and have less top jobs and yet lets get reparations to irish polish italians mexicans when we took over the mexico land in 1840s and all low wage immigrants
0,1.16E+18,2019-08-09 16:36:57+00:00,when you get taken over by spanish and european invaders you tend to pick up their violent behaviors
1,1.07E+18,2018-11-25 23:12:20+00:00,if they march on our country then its an invasion and should be treated as such we have the right to defend our borders by whatever means possible today immigrants violently attacked mexican police to charge the us border that is a violent invasion 
0,1.01E+18,2018-06-19 21:16:05+00:00,so sick of you who too are of immigrants treating others so horribly wanna bet it has mexican holocaust
0,1.59E+18,2022-10-26 02:15:26+00:00,run by hispanics paying taxes our democratic mayor is from cuban ancestry and the chief of police is also hispanic the region was the logistics center for the entire northeast during the pandemic powered by immigrants and so is manufacturing oz talked of fentanyl deaths
0,8.57E+17,2017-04-25 04:24:13+00:00,lol trump says buy american hire american yet he still hire immigrants buys his steel from china and daughter buys all her products from china
0,8.01E+17,2016-11-21 16:33:53+00:00,"son of undocumented mexican immigrants and alumni among 2017 rhodes scholars
see article "
0,8.61E+17,2017-05-06 17:29:38+00:00,so its not wh is vs immigrants just some japanese chinese russian ok
